{
  "name": "default-sketchy",
  "version": "0.1.0",
  "description": "The original hand-drawn Excalidraw look. Bundled with core; always available.",
  "license": "MIT",
  "author": "Timur Isachenko",
  "roles": {
    "ink": "#1e1e1e",
    "paper": "#ffffff",
    "accent": "#1971c2",
    "accent_alt": "#e8590c",
    "evidence_bg": "#1e1e1e",
    "evidence_text": "#d4d4d4",
    "muted": "#868e96",
    "warning": "#f08c00",
    "danger": "#c92a2a"
  }
}
